{
  "$schema": "https://json-schema.org/draft/2020-12/schema",
  "$id": "https://blup.dev/schemas/curriculum_plan.v1.schema.json",
  "title": "CurriculumPlan",
  "type": "object",
  "version": "1.0.0",
  "required": ["title", "chapters", "estimated_duration"],
  "properties": {
    "title": {
      "type": "string",
      "minLength": 3,
      "maxLength": 500,
      "description": "Curriculum title"
    },
    "description": {
      "type": "string",
      "maxLength": 2000,
      "description": "Overview of the learning path"
    },
    "chapters": {
      "type": "array",
      "minItems": 1,
      "maxItems": 50,
      "items": {
        "type": "object",
        "required": ["id", "title", "order", "objectives"],
        "properties": {
          "id": {
            "type": "string",
            "pattern": "^[a-z0-9]+(-[a-z0-9]+)*$",
            "maxLength": 100
          },
          "title": { "type": "string", "minLength": 3, "maxLength": 300 },
          "order": { "type": "integer", "minimum": 1 },
          "objectives": {
            "type": "array",
            "items": { "type": "string", "maxLength": 500 },
            "minItems": 1,
            "maxItems": 10
          },
          "prerequisites": {
            "type": "array",
            "items": { "type": "string", "maxLength": 200 },
            "maxItems": 10
          },
          "estimated_minutes": {
            "type": "integer",
            "minimum": 1,
            "maximum": 480
          }
        }
      }
    },
    "estimated_duration": {
      "type": "string",
      "maxLength": 200,
      "description": "Estimated total learning duration"
    },
    "prerequisites_summary": {
      "type": "array",
      "items": { "type": "string", "maxLength": 300 },
      "maxItems": 10
    },
    "learning_objectives": {
      "type": "array",
      "items": { "type": "string", "maxLength": 500 },
      "minItems": 1,
      "maxItems": 20
    }
  }
}
